identifier,name,type,damage_class,power,accuracy,pp,priority,target_identifier,flavor_text
mach-punch,Mach Punch,fighting,physical,40,100,30,1,chosen,The user throws a punch at blinding speed. This move always goes first.
scary-face,Scary Face,normal,status,,100,10,0,chosen,The user frightens the target with a scary face to harshly lower its Speed stat.
feint-attack,Feint Attack,dark,physical,60,,20,0,chosen,"The user approaches the target disarmingly, then throws a sucker punch. This attack never misses."
sweet-kiss,Sweet Kiss,fairy,status,,75,10,0,chosen,"The user kisses the target with a sweet, angelic cuteness that causes confusion."
belly-drum,Belly Drum,normal,status,,,10,0,self,The user maximizes its Attack stat in exchange for HP equal to half its max HP.
sludge-bomb,Sludge Bomb,poison,special,90,100,10,0,chosen,Unsanitary sludge is hurled at the target. This may also poison the target.
mud-slap,Mud-Slap,ground,special,20,100,10,0,chosen,The user hurls mud in the target’s face to inflict damage and lower its accuracy.
octazooka,Octazooka,water,special,65,85,10,0,chosen,The user attacks by spraying ink in the target’s face or eyes. This may also lower the target’s accuracy.
spikes,Spikes,ground,status,,,20,0,other-side,The user lays a trap of spikes at the opposing team’s feet. The trap hurts Pokémon that switch into battle.
zap-cannon,Zap Cannon,electric,special,120,50,5,0,chosen,The user fires an electric blast like a cannon to inflict damage and cause paralysis.
foresight,Foresight,normal,status,,,40,0,chosen,Enables a [[types:Ghost]]-type target to be hit by [[types:Normal]]- and [[types:Fighting]]-type attacks. This also enables an evasive target to be hit.
destiny-bond,Destiny Bond,ghost,status,,,5,0,self,"After using this move, if the user faints, the Pokémon that landed the knockout hit also faints. Its chance of failing rises if it is used in succession."
perish-song,Perish Song,normal,status,,,5,0,all,"Any Pokémon that hears this song faints in three turns, unless it switches out of battle."
icy-wind,Icy Wind,ice,special,55,95,15,0,all-opponents,The user attacks with a gust of chilled air. This also lowers opposing Pokémon’s Speed stats.
detect,Detect,fighting,status,,,5,4,self,This move enables the user to protect itself from all attacks. Its chance of failing rises if it is used in succession.
bone-rush,Bone Rush,ground,physical,25,90,10,0,chosen,The user strikes the target with a hard bone two to five times in a row.
lock-on,Lock-On,normal,status,,,5,0,chosen,The user takes sure aim at the target. This ensures the next attack does not miss the target.
outrage,Outrage,dragon,physical,120,100,10,0,random-opponent,The user rampages and attacks for two to three turns. The user then becomes confused.
sandstorm,Sandstorm,rock,status,,,10,0,both-sides,"A five-turn sandstorm is summoned to hurt all combatants except [[types:Rock]], [[types:Ground]], and [[types:Steel]] types. It raises the Sp. Def stat of [[types:Rock]] types."
giga-drain,Giga Drain,grass,special,75,100,10,0,chosen,A nutrient-draining attack. The user’s HP is restored by half the damage taken by the target.
endure,Endure,normal,status,,,10,4,self,The user endures any attack with at least 1 HP. Its chance of failing rises if it is used in succession.
charm,Charm,fairy,status,,100,20,0,chosen,"The user gazes at the target rather charmingly, making it less wary. This harshly lowers the target’s Attack stat."
rollout,Rollout,rock,physical,30,90,20,0,chosen,The user continually rolls into the target over five turns. It becomes more powerful each time it hits.
false-swipe,False Swipe,normal,physical,40,100,40,0,chosen,A restrained attack that prevents the target from fainting. The target is left with at least 1 HP.
swagger,Swagger,normal,status,,85,15,0,chosen,"The user enrages and confuses the target. However, this also sharply raises the target’s Attack stat."
milk-drink,Milk Drink,normal,status,,,10,0,self,The user restores its own HP by up to half of its max HP.
spark,Spark,electric,physical,65,100,20,0,chosen,The user throws an electrically charged tackle at the target. This may also leave the target with paralysis.
fury-cutter,Fury Cutter,bug,physical,40,95,20,0,chosen,The target is slashed with scythes or claws. This attack becomes more powerful if it hits in succession.
steel-wing,Steel Wing,steel,physical,70,90,25,0,chosen,The target is hit with wings of steel. This may also raise the user’s Defense stat.
mean-look,Mean Look,normal,status,,,5,0,chosen,"The user pins the target with a dark, arresting look. The target becomes unable to flee."
attract,Attract,normal,status,,100,15,0,chosen,"If it is the opposite gender of the user, the target becomes infatuated and less likely to attack."
sleep-talk,Sleep Talk,normal,status,,,10,0,self,"While it is asleep, the user randomly uses one of the moves it knows."
heal-bell,Heal Bell,normal,status,,,5,0,all-allies,The user makes a soothing bell chime to heal the status conditions of all the party Pokémon.
return,Return,normal,physical,,100,20,0,chosen,This full-power attack grows more powerful the more the user likes its Trainer.
present,Present,normal,physical,,90,15,0,chosen,"The user attacks by giving the target a gift with a hidden trap. It restores HP sometimes, however."
frustration,Frustration,normal,physical,,100,20,0,chosen,This full-power attack grows more powerful the less the user likes its Trainer.
safeguard,Safeguard,normal,status,,,25,0,user-side,The user creates a protective field that prevents status conditions for five turns.
pain-split,Pain Split,normal,status,,,20,0,chosen,"The user adds its HP to the target’s HP, then equally shares the combined HP with the target."
sacred-fire,Sacred Fire,fire,physical,100,95,5,0,chosen,The target is razed with a mystical fire of great intensity. This may also leave the target with a burn.
magnitude,Magnitude,ground,physical,,100,30,0,all-others,The user attacks everything around it with a ground-shaking quake. Its power varies.
dynamic-punch,Dynamic Punch,fighting,physical,100,50,5,0,chosen,"The user punches the target with full, concentrated power. This confuses the target if it hits."
megahorn,Megahorn,bug,physical,120,85,10,0,chosen,"Using its tough and impressive horn, the user rams into the target with no letup."
dragon-breath,Dragon Breath,dragon,special,60,100,20,0,chosen,The user exhales a mighty gust that inflicts damage. This may also leave the target with paralysis.
baton-pass,Baton Pass,normal,status,,,40,0,self,The user switches places with a party Pokémon in waiting and passes along any stat changes.
encore,Encore,normal,status,,100,5,0,chosen,The user compels the target to keep using the move it encored for three turns.
pursuit,Pursuit,dark,physical,40,100,20,0,chosen,The power of this attack move is doubled if it’s used on a target that’s switching out of battle.
rapid-spin,Rapid Spin,normal,physical,50,100,40,0,chosen,"A spin attack that can also eliminate such moves as [[moves:Bind]], [[moves:Wrap]], and [[moves:Leech Seed]]. This also raises the user’s Speed stat."
sweet-scent,Sweet Scent,normal,status,,100,20,0,all-opponents,A sweet scent that harshly lowers opposing Pokémon’s evasiveness.
iron-tail,Iron Tail,steel,physical,100,75,15,0,chosen,The target is slammed with a steel-hard tail. This may also lower the target’s Defense stat.
metal-claw,Metal Claw,steel,physical,50,95,35,0,chosen,The target is raked with steel claws. This may also raise the user’s Attack stat.
vital-throw,Vital Throw,fighting,physical,70,,10,-1,chosen,"The user attacks last. In return, this throw move never misses."
morning-sun,Morning Sun,normal,status,,,5,0,self,The user restores its own HP. The amount of HP regained varies with the weather.
synthesis,Synthesis,grass,status,,,5,0,self,The user restores its own HP. The amount of HP regained varies with the weather.
moonlight,Moonlight,fairy,status,,,5,0,self,The user restores its own HP. The amount of HP regained varies with the weather.
hidden-power,Hidden Power,normal,special,60,100,15,0,chosen,A unique attack that varies in type depending on the Pokémon using it.
cross-chop,Cross Chop,fighting,physical,100,80,5,0,chosen,The user delivers a double chop with its forearms crossed. Critical hits land more easily.
twister,Twister,dragon,special,40,100,20,0,all-opponents,The user whips up a vicious tornado to tear at opposing Pokémon. This may also make them flinch.
rain-dance,Rain Dance,water,status,,,5,0,both-sides,"The user summons a heavy rain that falls for five turns, powering up Water-type moves. It lowers the power of Fire-type moves."
sunny-day,Sunny Day,fire,status,,,5,0,both-sides,"The user intensifies the sun for five turns, powering up [[types:Fire]]-type moves. It lowers the power of [[types:Water]]-type moves."
crunch,Crunch,dark,physical,80,100,15,0,chosen,The user crunches up the target with sharp fangs. This may also lower the target’s Defense stat.
mirror-coat,Mirror Coat,psychic,special,,100,20,-5,unique,"A retaliation move that counters any special attack, inflicting double the damage taken."
psych-up,Psych Up,normal,status,,,10,0,chosen,The user hypnotizes itself into copying any stat change made by the target.
extreme-speed,Extreme Speed,normal,physical,80,100,5,2,chosen,The user charges the target at blinding speed. This move always goes first.
ancient-power,Ancient Power,rock,special,60,100,5,0,chosen,The user attacks with a prehistoric power. This may also raise all the user’s stats at once.
shadow-ball,Shadow Ball,ghost,special,80,100,15,0,chosen,The user hurls a shadowy blob at the target. This may also lower the target’s Sp. Def stat.
future-sight,Future Sight,psychic,special,120,100,10,0,chosen,"Two turns after this move is used, a hunk of psychic energy attacks the target."
rock-smash,Rock Smash,fighting,physical,40,100,15,0,chosen,The user attacks with a punch. This may also lower the target’s Defense stat.
whirlpool,Whirlpool,water,special,35,85,15,0,chosen,The user traps the target in a violent swirling whirlpool for four to five turns.
beat-up,Beat Up,dark,physical,,100,10,0,chosen,"The user gets all party Pokémon to attack the target. The more party Pokémon, the greater the number of attacks."
fake-out,Fake Out,normal,physical,40,100,10,3,chosen,This attack hits first and makes the target flinch. It only works the first turn each time the user enters battle.
uproar,Uproar,normal,special,90,100,10,0,random-opponent,"The user attacks in an uproar for three turns. During that time, no Pokémon can fall asleep."
stockpile,Stockpile,normal,status,,,20,0,self,The user charges up power and raises both its Defense and Sp. Def stats. The move can be used three times.
spit-up,Spit Up,normal,special,,100,10,0,chosen,"The power stored using the move [[moves:Stockpile]] is released at once in an attack. The more power is stored, the greater the move’s power."
swallow,Swallow,normal,status,,,10,0,self,The power stored using the move [[moves:Stockpile]] is absorbed by the user to heal its HP. Storing more power heals more HP.
heat-wave,Heat Wave,fire,special,95,90,10,0,all-opponents,The user attacks by exhaling hot breath on opposing Pokémon. This may also leave those Pokémon with a burn.
hail,Hail,ice,status,,,10,0,both-sides,The user summons a hailstorm lasting five turns. It damages all Pokémon except [[types:Ice]] types.
torment,Torment,dark,status,,100,15,0,chosen,"The user torments and enrages the target, making it incapable of using the same move twice in a row."
flatter,Flatter,dark,status,,100,15,0,chosen,"Flattery is used to confuse the target. However, this also raises the target’s Sp. Atk stat."
will-o-wisp,Will-O-Wisp,fire,status,,85,15,0,chosen,The user shoots a sinister flame at the target to inflict a burn.
memento,Memento,dark,status,,100,10,0,chosen,"The user faints when using this move. In return, this harshly lowers the target’s Attack and Sp. Atk stats."
facade,Facade,normal,physical,70,100,20,0,chosen,"This attack move doubles its power if the user is poisoned, burned, or paralyzed."
focus-punch,Focus Punch,fighting,physical,150,100,20,-3,chosen,The user focuses its mind before launching a punch. This move fails if the user is hit before it is used.
smelling-salts,Smelling Salts,normal,physical,70,100,10,0,chosen,"This attack’s power is doubled when used on a target with paralysis. This also cures the target’s paralysis, however."
follow-me,Follow Me,normal,status,,,20,2,self,"The user draws attention to itself, making all targets take aim only at the user."
nature-power,Nature Power,normal,status,,,20,0,chosen,This attack makes use of nature’s power. Its effects vary depending on the user’s environment.
charge,Charge,electric,status,,,20,0,self,The user boosts the power of the [[types:Electric]] move it uses on the next turn. This also raises the user’s Sp. Def stat.
taunt,Taunt,dark,status,,100,20,0,chosen,The target is taunted into a rage that allows it to use only attack moves for three turns.
helping-hand,Helping Hand,normal,status,,,20,5,chosen-ally,The user assists an ally by boosting the power of that ally’s attack.
trick,Trick,psychic,status,,100,10,0,chosen,The user catches the target off guard and swaps its held item with its own.
role-play,Role Play,psychic,status,,,10,0,chosen,"The user mimics the target completely, copying the target’s Ability."
wish,Wish,normal,status,,,10,0,self,"One turn after this move is used, the user’s or its replacement’s HP is restored by half the user’s max HP."
assist,Assist,normal,status,,,20,0,self,The user hurriedly and randomly uses a move among those known by ally Pokémon.
ingrain,Ingrain,grass,status,,,20,0,self,"The user lays roots that restore its HP on every turn. Because it’s rooted, it can’t switch out."
superpower,Superpower,fighting,physical,120,100,5,0,chosen,"The user attacks the target with great power. However, this also lowers the user’s Attack and Defense stats."
magic-coat,Magic Coat,psychic,status,,,15,4,self,Moves like[[moves:Leech Seed]] and moves that inflict status conditions are blocked by a barrier and reflected back to the user of those moves.
recycle,Recycle,normal,status,,,10,0,self,The user recycles a held item that has been used in battle so it can be used again.
revenge,Revenge,fighting,physical,60,100,10,-4,chosen,This attack move’s power is doubled if the user has been hurt by the opponent in the same turn.
brick-break,Brick Break,fighting,physical,75,100,15,0,chosen,"The user attacks with a swift chop. It can also break barriers, such as [[moves:Light Screen]] and [[moves:Reflect]]."
yawn,Yawn,normal,status,,,10,0,chosen,The user lets loose a huge yawn that lulls the target into falling asleep on the next turn.
knock-off,Knock Off,dark,physical,65,100,20,0,chosen,"The user slaps down the target’s held item, and that item can’t be used in that battle. The move does more damage if the target has a held item."
endeavor,Endeavor,normal,physical,,100,5,0,chosen,This attack move cuts down the target’s HP to equal the user’s HP.
eruption,Eruption,fire,special,150,100,5,0,all-opponents,"The user attacks opposing Pokémon with explosive fury. The lower the user’s HP, the lower the move’s power."
skill-swap,Skill Swap,psychic,status,,,10,0,chosen,The user employs its psychic power to exchange Abilities with the target.
imprison,Imprison,psychic,status,,,10,0,self,"If opposing Pokémon know any move also known by the user, they are prevented from using it."
refresh,Refresh,normal,status,,,20,0,self,"The user rests to cure itself of poisoning, a burn, or paralysis."
grudge,Grudge,ghost,status,,,5,0,self,"If the user faints, the user’s grudge fully depletes the PP of the opponent’s move that knocked it out."
snatch,Snatch,dark,status,,,10,4,self,The user steals the effects of any attempts to use a healing or stat-changing move.
secret-power,Secret Power,normal,physical,70,100,20,0,chosen,The additional effects of this attack depend upon where it was used.
dive,Dive,water,physical,80,100,10,0,chosen,"Diving on the first turn, the user floats up and attacks on the next turn."
arm-thrust,Arm Thrust,fighting,physical,15,100,20,0,chosen,The user lets loose a flurry of open-palmed arm thrusts that hit two to five times in a row.
camouflage,Camouflage,normal,status,,,20,0,self,"The user’s type is changed depending on its environment, such as at water’s edge, in grass, or in a cave."
tail-glow,Tail Glow,bug,status,,,20,0,self,"The user stares at flashing lights to focus its mind, drastically raising its Sp. Atk stat."
luster-purge,Luster Purge,psychic,special,70,100,5,0,chosen,The user lets loose a damaging burst of light. This may also lower the target’s Sp. Def stat.
mist-ball,Mist Ball,psychic,special,70,100,5,0,chosen,A mist-like flurry of down envelops and damages the target. This may also lower the target’s Sp. Atk stat.
feather-dance,Feather Dance,flying,status,,100,15,0,chosen,The user covers the target’s body with a mass of down that harshly lowers its Attack stat.
teeter-dance,Teeter Dance,normal,status,,100,20,0,all-others,The user performs a wobbly dance that confuses the Pokémon around it.
blaze-kick,Blaze Kick,fire,physical,85,90,10,0,chosen,The user launches a kick that lands a critical hit more easily. This may also leave the target with a burn.
mud-sport,Mud Sport,ground,status,,,15,0,both-sides,The user kicks up mud on the battlefield. This weakens [[types:Electric]]-type moves for five turns.
ice-ball,Ice Ball,ice,physical,30,90,20,0,chosen,The user attacks the target for five turns. The move’s power increases each time it hits.
needle-arm,Needle Arm,grass,physical,60,100,15,0,chosen,The user attacks by wildly swinging its thorny arms. This may also make the target flinch.
slack-off,Slack Off,normal,status,,,10,0,self,"The user slacks off, restoring its own HP by up to half of its max HP."
hyper-voice,Hyper Voice,normal,special,90,100,10,0,all-opponents,The user lets loose a horribly echoing shout with the power to inflict damage.
poison-fang,Poison Fang,poison,physical,50,100,15,0,chosen,The user bites the target with toxic fangs. This may also leave the target badly poisoned.
crush-claw,Crush Claw,normal,physical,75,95,10,0,chosen,The user slashes the target with hard and sharp claws. This may also lower the target’s Defense stat.
blast-burn,Blast Burn,fire,special,150,90,5,0,chosen,The target is razed by a fiery explosion. The user can’t move on the next turn.
hydro-cannon,Hydro Cannon,water,special,150,90,5,0,chosen,The target is hit with a watery blast. The user can’t move on the next turn.
meteor-mash,Meteor Mash,steel,physical,90,90,10,0,chosen,The target is hit with a hard punch fired like a meteor. This may also raise the user’s Attack stat.
astonish,Astonish,ghost,physical,30,100,15,0,chosen,The user attacks the target while shouting in a startling fashion. This may also make the target flinch.
weather-ball,Weather Ball,normal,special,50,100,10,0,chosen,This attack move varies in power and type depending on the weather.
aromatherapy,Aromatherapy,grass,status,,,5,0,all-allies,The user releases a soothing scent that heals all status conditions affecting the user’s party.
fake-tears,Fake Tears,dark,status,,100,20,0,chosen,"The user feigns crying to fluster the target, harshly lowering its Sp. Def stat."
air-cutter,Air Cutter,flying,special,60,95,25,0,all-opponents,The user launches razor-like wind to slash opposing Pokémon. Critical hits land more easily.
overheat,Overheat,fire,special,130,90,5,0,chosen,The user attacks the target at full power. The attack’s recoil harshly lowers the user’s Sp. Atk stat.
odor-sleuth,Odor Sleuth,normal,status,,,40,0,chosen,Enables a [[types:Ghost]]-type target to be hit by [[types:Normal]]- and [[types:Fighting]]-type attacks. This also enables an evasive target to be hit.
rock-tomb,Rock Tomb,rock,physical,60,95,15,0,chosen,Boulders are hurled at the target. This also lowers the target’s Speed stat by preventing its movement.
silver-wind,Silver Wind,bug,special,60,100,5,0,chosen,The target is attacked with powdery scales blown by the wind. This may also raise all the user’s stats.
metal-sound,Metal Sound,steel,status,,85,40,0,chosen,A horrible sound like scraping metal harshly lowers the target’s Sp. Def stat.
grass-whistle,Grass Whistle,grass,status,,55,15,0,chosen,The user plays a pleasant melody that lulls the target into a deep sleep.
tickle,Tickle,normal,status,,100,20,0,chosen,"The user tickles the target into laughing, reducing its Attack and Defense stats."
cosmic-power,Cosmic Power,psychic,status,,,20,0,self,The user absorbs a mystical power from space to raise its Defense and Sp. Def stats.
water-spout,Water Spout,water,special,150,100,5,0,all-opponents,"The user spouts water to damage opposing Pokémon. The lower the user’s HP, the lower the move’s power."
signal-beam,Signal Beam,bug,special,75,100,15,0,chosen,The user attacks with a sinister beam of light. This may also confuse the target.
shadow-punch,Shadow Punch,ghost,physical,60,,20,0,chosen,The user throws a punch from the shadows. This attack never misses.
extrasensory,Extrasensory,psychic,special,80,100,20,0,chosen,"The user attacks with an odd, unseeable power. This may also make the target flinch."
sky-uppercut,Sky Uppercut,fighting,physical,85,90,15,0,chosen,The user attacks the target with an uppercut thrown skyward with force.
sand-tomb,Sand Tomb,ground,physical,35,85,15,0,chosen,The user traps the target inside a harshly raging sandstorm for four to five turns.
sheer-cold,Sheer Cold,ice,special,,30,5,0,chosen,The target faints instantly. It’s less likely to hit the target if it’s used by Pokémon other than [[types:Ice]] types.
muddy-water,Muddy Water,water,special,90,85,10,0,all-opponents,The user attacks by shooting muddy water at opposing Pokémon. This may also lower their accuracy.
bullet-seed,Bullet Seed,grass,physical,25,100,30,0,chosen,The user forcefully shoots seeds at the target two to five times in a row.
aerial-ace,Aerial Ace,flying,physical,60,,20,0,chosen,"The user confounds the target with speed, then slashes. This attack never misses."
icicle-spear,Icicle Spear,ice,physical,25,100,30,0,chosen,The user launches sharp icicles at the target two to five times in a row.
iron-defense,Iron Defense,steel,status,,,15,0,self,"The user hardens its body’s surface like iron, sharply raising its Defense stat."
block,Block,normal,status,,,5,0,chosen,The user blocks the target’s way with arms spread wide to prevent escape.
howl,Howl,normal,status,,,40,0,all-allies,The user howls loudly to raise the spirit of itself and allies. This raises their Attack stats.
dragon-claw,Dragon Claw,dragon,physical,80,100,15,0,chosen,The user slashes the target with huge sharp claws.
frenzy-plant,Frenzy Plant,grass,special,150,90,5,0,chosen,The user slams the target with the roots of an enormous tree. The user can’t move on the next turn.
bulk-up,Bulk Up,fighting,status,,,20,0,self,"The user tenses its muscles to bulk up its body, raising both its Attack and Defense stats."
bounce,Bounce,flying,physical,85,85,5,0,chosen,"The user bounces up high, then drops on the target on the second turn. This may also leave the target with paralysis."
mud-shot,Mud Shot,ground,special,55,95,15,0,chosen,The user attacks by hurling a blob of mud at the target. This also lowers the target’s Speed stat.
poison-tail,Poison Tail,poison,physical,50,100,25,0,chosen,The user hits the target with its tail. This may also poison the target. Critical hits land more easily.
covet,Covet,normal,physical,60,100,25,0,chosen,"The user endearingly approaches the target, then steals the target’s held item."
volt-tackle,Volt Tackle,electric,physical,120,100,15,0,chosen,The user electrifies itself and charges the target. This also damages the user quite a lot. This attack may leave the target with paralysis.
magical-leaf,Magical Leaf,grass,special,60,,20,0,chosen,The user scatters curious leaves that chase the target. This attack never misses.
water-sport,Water Sport,water,status,,,15,0,both-sides,The user soaks the battlefield with water. This weakens [[types:Fire]]-type moves for five turns.
calm-mind,Calm Mind,psychic,status,,,20,0,self,The user quietly focuses its mind and calms its spirit to raise its Sp. Atk and Sp. Def stats.
leaf-blade,Leaf Blade,grass,physical,90,100,15,0,chosen,The user handles a sharp leaf like a sword and attacks by cutting its target. Critical hits land more easily.
dragon-dance,Dragon Dance,dragon,status,,,20,0,self,"The user vigorously performs a mystic, powerful dance that raises its Attack and Speed stats."
rock-blast,Rock Blast,rock,physical,25,90,10,0,chosen,The user hurls hard rocks at the target. Two to five rocks are launched in a row.
shock-wave,Shock Wave,electric,special,60,,20,0,chosen,The user strikes the target with a quick jolt of electricity. This attack never misses.
water-pulse,Water Pulse,water,special,60,100,20,0,chosen,The user attacks the target with a pulsing blast of water. This may also confuse the target.
doom-desire,Doom Desire,steel,special,140,100,5,0,chosen,"Two turns after this move is used, a concentrated bundle of light blasts the target."
psycho-boost,Psycho Boost,psychic,special,140,90,5,0,chosen,The user attacks the target at full power. The attack’s recoil harshly lowers the user’s Sp. Atk stat.
roost,Roost,flying,status,,,10,0,self,The user lands and rests its body. This move restores the user’s HP by up to half of its max HP.
gravity,Gravity,psychic,status,,,5,0,both-sides,This move enables [[types:Flying]]-type Pokémon or Pokémon with the [[abilities:Levitate]] Ability to be hit by [[types:Ground]]-type moves. Moves that involve flying can’t be used.
