identifier,name,type,damage_class,power,accuracy,pp,priority,target_identifier,flavor_text
miracle-eye,Miracle Eye,psychic,status,,,40,0,chosen,Enables a Dark-type target to be hit by Psychic-type attacks. This also enables an evasive target to be hit.
wake-up-slap,Wake-Up Slap,fighting,physical,70,100,10,0,chosen,"This attack inflicts big damage on a sleeping target. This also wakes the target up, however."
hammer-arm,Hammer Arm,fighting,physical,100,90,10,0,chosen,"The user swings and hits with its strong, heavy fist. It lowers the user’s Speed, however."
gyro-ball,Gyro Ball,steel,physical,,100,5,0,chosen,"The user tackles the target with a high-speed spin. The slower the user compared to the target, the greater the move’s power."
healing-wish,Healing Wish,psychic,status,,,10,0,self,"The user faints. In return, the Pokémon taking its place will have its HP restored and status conditions cured."
brine,Brine,water,special,65,100,10,0,chosen,"If the target’s HP is half or less, this attack will hit with double the power."
natural-gift,Natural Gift,normal,physical,,100,15,0,chosen,The user draws power to attack by using its held Berry. The Berry determines the move’s type and power.
feint,Feint,normal,physical,30,100,10,2,chosen,This attack hits a target using a move such as [[moves:Protect]] or [[moves:Detect]]. This also lifts the effects of those moves.
pluck,Pluck,flying,physical,60,100,20,0,chosen,"The user pecks the target. If the target is holding a Berry, the user eats it and gains its effect."
tailwind,Tailwind,flying,status,,,15,0,user-side,The user whips up a turbulent whirlwind that ups the Speed stats of the user and its allies for four turns.
acupressure,Acupressure,normal,status,,,30,0,chosen-ally,"The user applies pressure to stress points, sharply boosting one of its or its allies’ stats."
metal-burst,Metal Burst,steel,physical,,100,10,0,unique,The user retaliates with much greater force against the opponent that last inflicted damage on it.
u-turn,U-turn,bug,physical,70,100,20,0,chosen,"After making its attack, the user rushes back to switch places with a party Pokémon in waiting."
close-combat,Close Combat,fighting,physical,120,100,5,0,chosen,The user fights the target up close without guarding itself. This also lowers the user’s Defense and Sp. Def stats.
payback,Payback,dark,physical,50,100,10,0,chosen,"The user stores power, then attacks. If the user moves after the target, this attack’s power will be doubled."
assurance,Assurance,dark,physical,60,100,10,0,chosen,"If the target has already taken some damage in the same turn, this attack’s power is doubled."
embargo,Embargo,dark,status,,100,15,0,chosen,This move prevents the target from using its held item for five turns. Its Trainer is also prevented from using items on it.
fling,Fling,dark,physical,,100,10,0,chosen,The user flings its held item at the target to attack. This move’s power and effects depend on the item.
psycho-shift,Psycho Shift,psychic,status,,100,10,0,chosen,"Using its psychic power of suggestion, the user transfers its status conditions to the target."
trump-card,Trump Card,normal,special,,,5,0,chosen,"The fewer PP this move has, the greater its power."
heal-block,Heal Block,psychic,status,,100,15,0,all-opponents,"For five turns, the user prevents the opposing team from using any moves, Abilities, or held items that recover HP."
wring-out,Wring Out,normal,special,,100,5,0,chosen,"The user powerfully wrings the target. The more HP the target has, the greater the move’s power."
power-trick,Power Trick,psychic,status,,,10,0,self,The user employs its psychic power to switch its Attack stat with its Defense stat.
gastro-acid,Gastro Acid,poison,status,,100,10,0,chosen,The user hurls up its stomach acids on the target. The fluid eliminates the effect of the target’s Ability.
lucky-chant,Lucky Chant,normal,status,,,30,0,user-side,"The user chants an incantation toward the sky, preventing opposing Pokémon from landing critical hits for five turns."
me-first,Me First,normal,status,,,20,0,unique,The user cuts ahead of the target to copy and use the target’s intended move with greater power. This move fails if it isn’t used first.
copycat,Copycat,normal,status,,,20,0,self,The user mimics the move used immediately before it. The move fails if no other move has been used yet.
power-swap,Power Swap,psychic,status,,,10,0,chosen,The user employs its psychic power to switch changes to its Attack and Sp. Atk stats with the target.
guard-swap,Guard Swap,psychic,status,,,10,0,chosen,The user employs its psychic power to switch changes to its Defense and Sp. Def stats with the target.
punishment,Punishment,dark,physical,,100,5,0,chosen,"The more the target has powered up with stat changes, the greater the move’s power."
last-resort,Last Resort,normal,physical,140,100,5,0,chosen,This move can be used only after the user has used all the other moves it knows in the battle.
worry-seed,Worry Seed,grass,status,,100,10,0,chosen,A seed that causes worry is planted on the target. It prevents sleep by making the target’s Ability Insomnia.
sucker-punch,Sucker Punch,dark,physical,70,100,5,1,chosen,This move enables the user to attack first. This move fails if the target is not readying an attack.
toxic-spikes,Toxic Spikes,poison,status,,,20,0,other-side,The user lays a trap of poison spikes at the feet of the opposing team. The spikes will poison opposing Pokémon that switch into battle.
heart-swap,Heart Swap,psychic,status,,,10,0,chosen,The user employs its psychic power to switch stat changes with the target.
aqua-ring,Aqua Ring,water,status,,,20,0,self,The user envelops itself in a veil made of water. It regains some HP every turn.
magnet-rise,Magnet Rise,electric,status,,,10,0,self,The user levitates using electrically generated magnetism for five turns.
flare-blitz,Flare Blitz,fire,physical,120,100,15,0,chosen,The user cloaks itself in fire and charges the target. This also damages the user quite a lot. This attack may leave the target with a burn.
force-palm,Force Palm,fighting,physical,60,100,10,0,chosen,The target is attacked with a shock wave. This may also leave the target with paralysis.
aura-sphere,Aura Sphere,fighting,special,80,,20,0,chosen,The user lets loose a blast of aura power from deep within its body at the target. This attack never misses.
rock-polish,Rock Polish,rock,status,,,20,0,self,The user polishes its body to reduce drag. This sharply raises the Speed stat.
poison-jab,Poison Jab,poison,physical,80,100,20,0,chosen,"The target is stabbed with a tentacle, arm, or the like steeped in poison. This may also poison the target."
dark-pulse,Dark Pulse,dark,special,80,100,15,0,chosen,The user releases a horrible aura imbued with dark thoughts. This may also make the target flinch.
night-slash,Night Slash,dark,physical,70,100,15,0,chosen,The user slashes the target the instant an opportunity arises. Critical hits land more easily.
aqua-tail,Aqua Tail,water,physical,90,90,10,0,chosen,The user attacks by swinging its tail as if it were a vicious wave in a raging storm.
seed-bomb,Seed Bomb,grass,physical,80,100,15,0,chosen,The user slams a barrage of hard-shelled seeds down on the target from above.
air-slash,Air Slash,flying,special,75,95,15,0,chosen,The user attacks with a blade of air that slices even the sky. This may also make the target flinch.
x-scissor,X-Scissor,bug,physical,80,100,15,0,chosen,The user slashes at the target by crossing its scythes or claws as if they were a pair of scissors.
bug-buzz,Bug Buzz,bug,special,90,100,10,0,chosen,The user generates a damaging sound wave by vibration. This may also lower the target’s Sp. Def stat.
dragon-pulse,Dragon Pulse,dragon,special,85,100,10,0,chosen,The target is attacked with a shock wave generated by the user’s gaping mouth.
dragon-rush,Dragon Rush,dragon,physical,100,75,10,0,chosen,The user tackles the target while exhibiting overwhelming menace. This may also make the target flinch.
power-gem,Power Gem,rock,special,80,100,20,0,chosen,The user attacks with a ray of light that sparkles as if it were made of gemstones.
drain-punch,Drain Punch,fighting,physical,75,100,10,0,chosen,An energy-draining punch. The user’s HP is restored by half the damage taken by the target.
vacuum-wave,Vacuum Wave,fighting,special,40,100,30,1,chosen,The user whirls its fists to send a wave of pure vacuum at the target. This move always goes first.
focus-blast,Focus Blast,fighting,special,120,70,5,0,chosen,The user heightens its mental focus and unleashes its power. This may also lower the target’s Sp. Def stat.
energy-ball,Energy Ball,grass,special,90,100,10,0,chosen,The user draws power from nature and fires it at the target. This may also lower the target’s Sp. Def stat.
brave-bird,Brave Bird,flying,physical,120,100,15,0,chosen,The user tucks in its wings and charges from a low altitude. This also damages the user quite a lot.
earth-power,Earth Power,ground,special,90,100,10,0,chosen,The user makes the ground under the target erupt with power. This may also lower the target’s Sp. Def stat.
switcheroo,Switcheroo,dark,status,,100,10,0,chosen,The user trades held items with the target faster than the eye can follow.
giga-impact,Giga Impact,normal,physical,150,90,5,0,chosen,The user charges at the target using every bit of its power. The user can’t move on the next turn.
nasty-plot,Nasty Plot,dark,status,,,20,0,self,The user stimulates its brain by thinking bad thoughts. This sharply raises the user’s Sp. Atk stat.
bullet-punch,Bullet Punch,steel,physical,40,100,30,1,chosen,The user strikes the target with tough punches as fast as bullets. This move always goes first.
avalanche,Avalanche,ice,physical,60,100,10,-4,chosen,The power of this attack move is doubled if the user has been hurt by the target in the same turn.
ice-shard,Ice Shard,ice,physical,40,100,30,1,chosen,The user flash-freezes chunks of ice and hurls them at the target. This move always goes first.
shadow-claw,Shadow Claw,ghost,physical,70,100,15,0,chosen,The user slashes with a sharp claw made from shadows. Critical hits land more easily.
thunder-fang,Thunder Fang,electric,physical,65,95,15,0,chosen,The user bites with electrified fangs. This may also make the target flinch or leave it with paralysis.
ice-fang,Ice Fang,ice,physical,65,95,15,0,chosen,The user bites with cold-infused fangs. This may also make the target flinch or leave it frozen.
fire-fang,Fire Fang,fire,physical,65,95,15,0,chosen,The user bites with flame-cloaked fangs. This may also make the target flinch or leave it with a burn.
shadow-sneak,Shadow Sneak,ghost,physical,40,100,30,1,chosen,The user extends its shadow and attacks the target from behind. This move always goes first.
mud-bomb,Mud Bomb,ground,special,65,85,10,0,chosen,The user launches a hard-packed mud ball to attack. This may also lower the target’s accuracy.
psycho-cut,Psycho Cut,psychic,physical,70,100,20,0,chosen,The user tears at the target with blades formed by psychic power. Critical hits land more easily.
zen-headbutt,Zen Headbutt,psychic,physical,80,90,15,0,chosen,The user focuses its willpower to its head and attacks the target. This may also make the target flinch.
mirror-shot,Mirror Shot,steel,special,65,85,10,0,chosen,The user lets loose a flash of energy at the target from its polished body. This may also lower the target’s accuracy.
flash-cannon,Flash Cannon,steel,special,80,100,10,0,chosen,The user gathers all its light energy and releases it all at once. This may also lower the target’s Sp. Def stat.
rock-climb,Rock Climb,normal,physical,90,85,20,0,chosen,The user attacks the target by smashing into it with incredible force. This may also confuse the target.
defog,Defog,flying,status,,,15,0,chosen,A strong wind blows away the target’s barriers such as [[moves:Reflect]] or [[moves:Light Screen]]. This also lowers the target’s evasiveness.
trick-room,Trick Room,psychic,status,,,5,-7,both-sides,The user creates a bizarre area in which slower Pokémon get to move first for five turns.
draco-meteor,Draco Meteor,dragon,special,130,90,5,0,chosen,Comets are summoned down from the sky onto the target. The attack’s recoil harshly lowers the user’s Sp. Atk stat.
discharge,Discharge,electric,special,80,100,15,0,all-others,The user strikes everything around it by letting loose a flare of electricity. This may also cause paralysis.
lava-plume,Lava Plume,fire,special,80,100,15,0,all-others,The user torches everything around it in an inferno of scarlet flames. This may also leave those it hits with a burn.
leaf-storm,Leaf Storm,grass,special,130,90,5,0,chosen,The user whips up a storm of leaves around the target. The attack’s recoil harshly lowers the user’s Sp. Atk stat.
power-whip,Power Whip,grass,physical,120,85,10,0,chosen,"The user violently whirls its vines, tentacles, or the like to harshly lash the target."
rock-wrecker,Rock Wrecker,rock,physical,150,90,5,0,chosen,The user launches a huge boulder at the target to attack. The user can’t move on the next turn.
cross-poison,Cross Poison,poison,physical,70,100,20,0,chosen,A slashing attack with a poisonous blade that may also poison the target. Critical hits land more easily.
gunk-shot,Gunk Shot,poison,physical,120,80,5,0,chosen,The user shoots filthy garbage at the target to attack. This may also poison the target.
iron-head,Iron Head,steel,physical,80,100,15,0,chosen,The user slams the target with its steel-hard head. This may also make the target flinch.
magnet-bomb,Magnet Bomb,steel,physical,60,,20,0,chosen,The user launches steel bombs that stick to the target. This attack never misses.
stone-edge,Stone Edge,rock,physical,100,80,5,0,chosen,The user stabs the target from below with sharpened stones. Critical hits land more easily.
captivate,Captivate,normal,status,,100,20,0,all-opponents,"If any opposing Pokémon is the opposite gender of the user, it is charmed, which harshly lowers its Sp. Atk stat."
stealth-rock,Stealth Rock,rock,status,,,20,0,other-side,The user lays a trap of levitating stones around the opposing team. The trap hurts opposing Pokémon that switch into battle.
grass-knot,Grass Knot,grass,special,,100,20,0,chosen,"The user snares the target with grass and trips it. The heavier the target, the greater the move’s power."
chatter,Chatter,flying,special,65,100,20,0,chosen,The user attacks the target with sound waves of deafening chatter. This confuses the target.
judgment,Judgment,normal,special,100,100,10,0,chosen,The user releases countless shots of light at the target. This move’s type varies depending on the kind of Plate the user is holding.
bug-bite,Bug Bite,bug,physical,60,100,20,0,chosen,"The user bites the target. If the target is holding a Berry, the user eats it and gains its effect."
charge-beam,Charge Beam,electric,special,50,90,10,0,chosen,The user attacks the target with an electric charge. The user may use any remaining electricity to raise its Sp. Atk stat.
wood-hammer,Wood Hammer,grass,physical,120,100,15,0,chosen,The user slams its rugged body into the target to attack. This also damages the user quite a lot.
aqua-jet,Aqua Jet,water,physical,40,100,20,1,chosen,The user lunges at the target at a speed that makes it almost invisible. This move always goes first.
attack-order,Attack Order,bug,physical,90,100,15,0,chosen,The user calls out its underlings to pummel the target. Critical hits land more easily.
defend-order,Defend Order,bug,status,,,10,0,self,"The user calls out its underlings to shield its body, raising its Defense and Sp. Def stats."
heal-order,Heal Order,bug,status,,,10,0,self,The user calls out its underlings to heal it. The user regains up to half of its max HP.
head-smash,Head Smash,rock,physical,150,80,5,0,chosen,"The user attacks the target with a hazardous, full-power headbutt. This also damages the user terribly."
double-hit,Double Hit,normal,physical,35,90,10,0,chosen,"The user slams the target with a long tail, vines, or a tentacle. The target is hit twice in a row."
roar-of-time,Roar of Time,dragon,special,150,90,5,0,chosen,The user blasts the target with power that distorts even time. The user can’t move on the next turn.
spacial-rend,Spacial Rend,dragon,special,100,95,5,0,chosen,The user tears the target along with the space around it. Critical hits land more easily.
lunar-dance,Lunar Dance,psychic,status,,,10,0,self,"The user faints. In return, the Pokémon taking its place will have its status and HP fully restored."
crush-grip,Crush Grip,normal,physical,,100,5,0,chosen,"The target is crushed with great force. The more HP the target has left, the greater this move’s power."
magma-storm,Magma Storm,fire,special,100,75,5,0,chosen,The target becomes trapped within a maelstrom of fire that rages for four to five turns.
dark-void,Dark Void,dark,status,,50,10,0,all-opponents,Opposing Pokémon are dragged into a world of total darkness that makes them sleep.
seed-flare,Seed Flare,grass,special,120,85,5,0,chosen,The user emits a shock wave from its body to attack its target. This may also harshly lower the target’s Sp. Def stat.
ominous-wind,Ominous Wind,ghost,special,60,100,5,0,chosen,The user blasts the target with a gust of repulsive wind. This may also raise all the user’s stats at once.
shadow-force,Shadow Force,ghost,physical,120,100,5,0,chosen,"The user disappears, then strikes the target on the next turn. This move hits even if the target protects itself."
hone-claws,Hone Claws,dark,status,,,15,0,self,The user sharpens its claws to boost its Attack stat and accuracy.
wide-guard,Wide Guard,rock,status,,,10,3,user-side,The user and its allies are protected from wide-ranging attacks for one turn.
guard-split,Guard Split,psychic,status,,,10,0,chosen,The user employs its psychic power to average its Defense and Sp. Def stats with those of the target.
power-split,Power Split,psychic,status,,,10,0,chosen,The user employs its psychic power to average its Attack and Sp. Atk stats with those of the target.
wonder-room,Wonder Room,psychic,status,,,10,0,both-sides,The user creates a bizarre area in which Pokémon’s Defense and Sp. Def stats are swapped for five turns.
psyshock,Psyshock,psychic,special,80,100,10,0,chosen,The user materializes an odd psychic wave to attack the target. This attack does physical damage.
venoshock,Venoshock,poison,special,65,100,10,0,chosen,The user drenches the target in a special poisonous liquid. This move’s power is doubled if the target is poisoned.
autotomize,Autotomize,steel,status,,,15,0,self,The user sheds part of its body to make itself lighter and sharply raise its Speed stat.
rage-powder,Rage Powder,bug,status,,,20,2,self,The user scatters a cloud of irritating powder to draw attention to itself. Opposing Pokémon aim only at the user.
telekinesis,Telekinesis,psychic,status,,,15,0,chosen,The user makes the target float with its psychic power. The target is easier to hit for three turns.
magic-room,Magic Room,psychic,status,,,10,0,both-sides,The user creates a bizarre area in which Pokémon’s held items lose their effects for five turns.
smack-down,Smack Down,rock,physical,50,100,15,0,chosen,The user throws a stone or similar projectile to attack the target. A flying Pokémon will fall to the ground when it’s hit.
storm-throw,Storm Throw,fighting,physical,60,100,10,0,chosen,The user strikes the target with a fierce blow. This attack always results in a critical hit.
flame-burst,Flame Burst,fire,special,70,100,15,0,chosen,The user attacks the target with a bursting flame. The bursting flame damages Pokémon next to the target as well.
sludge-wave,Sludge Wave,poison,special,95,100,10,0,all-others,The user strikes everything around it by swamping the area with a giant sludge wave. This may also poison those hit.
quiver-dance,Quiver Dance,bug,status,,,20,0,self,"The user lightly performs a beautiful, mystic dance. This boosts the user’s Sp. Atk, Sp. Def, and Speed stats."
heavy-slam,Heavy Slam,steel,physical,,100,10,0,chosen,"The user slams into the target with its heavy body. The more the user outweighs the target, the greater the move’s power."
synchronoise,Synchronoise,psychic,special,120,100,10,0,all-others,"Using an odd shock wave, the user inflicts damage on any Pokémon of the same type in the area around it."
electro-ball,Electro Ball,electric,special,,100,10,0,chosen,"The user hurls an electric orb at the target. The faster the user is than the target, the greater the move’s power."
soak,Soak,water,status,,100,20,0,chosen,The user shoots a torrent of water at the target and changes the target’s type to [[types:Water]].
flame-charge,Flame Charge,fire,physical,50,100,20,0,chosen,"Cloaking itself in flame, the user attacks the target. Then, building up more power, the user raises its Speed stat."
coil,Coil,poison,status,,,20,0,self,The user coils up and concentrates. This raises its Attack and Defense stats as well as its accuracy.
low-sweep,Low Sweep,fighting,physical,65,100,20,0,chosen,"The user makes a swift attack on the target’s legs, which lowers the target’s Speed stat."
acid-spray,Acid Spray,poison,special,40,100,20,0,chosen,The user spits fluid that works to melt the target. This harshly lowers the target’s Sp. Def stat.
foul-play,Foul Play,dark,physical,95,100,15,0,chosen,"The user turns the target’s power against it. The higher the target’s Attack stat, the greater the damage it deals."
simple-beam,Simple Beam,normal,status,,100,15,0,chosen,The user’s mysterious psychic wave changes the target’s Ability to [[abilities:Simple]].
entrainment,Entrainment,normal,status,,100,15,0,chosen,"The user dances with an odd rhythm that compels the target to mimic it, making the target’s Ability the same as the user’s."
after-you,After You,normal,status,,,15,0,chosen,The user helps the target and makes it use its move right after the user.
round,Round,normal,special,60,100,15,0,chosen,The user attacks the target with a song. Others can join in the Round to increase the power of the attack.
echoed-voice,Echoed Voice,normal,special,40,100,15,0,chosen,"The user attacks the target with an echoing voice. If this move is used every turn, its power is increased."
chip-away,Chip Away,normal,physical,70,100,20,0,chosen,"Looking for an opening, the user strikes consistently. The target’s stat changes don’t affect this attack’s damage."
clear-smog,Clear Smog,poison,special,50,,15,0,chosen,The user attacks the target by throwing a clump of special mud. All stat changes are returned to normal.
stored-power,Stored Power,psychic,special,20,100,10,0,chosen,"The user attacks the target with stored power. The more the user’s stats are raised, the greater the move’s power."
quick-guard,Quick Guard,fighting,status,,,15,3,user-side,The user protects itself and its allies from priority moves.
ally-switch,Ally Switch,psychic,status,,,15,2,self,The user teleports using a strange power and switches places with one of its allies.
scald,Scald,water,special,80,100,15,0,chosen,The user shoots boiling hot water at its target. This may also leave the target with a burn.
shell-smash,Shell Smash,normal,status,,,15,0,self,"The user breaks its shell, which lowers Defense and Sp. Def stats but sharply raises its Attack, Sp. Atk, and Speed stats."
heal-pulse,Heal Pulse,psychic,status,,,10,0,chosen,The user emits a healing pulse that restores the target’s HP by up to half of its max HP.
hex,Hex,ghost,special,65,100,10,0,chosen,This relentless attack does massive damage to a target affected by status conditions.
sky-drop,Sky Drop,flying,physical,60,100,10,0,chosen,"The user takes the target into the sky, then drops it during the next turn. The target cannot attack while in the sky."
shift-gear,Shift Gear,steel,status,,,10,0,self,"The user rotates its gears, raising its Attack stat and sharply raising its Speed stat."
circle-throw,Circle Throw,fighting,physical,60,90,10,-6,chosen,"The target is thrown, and a different Pokémon is dragged out. In the wild, this ends a battle against a single Pokémon."
incinerate,Incinerate,fire,special,60,100,15,0,all-opponents,"The user attacks opposing Pokémon with fire. If a Pokémon is holding a certain item, such as a Berry, the item becomes burned up and unusable."
quash,Quash,dark,status,,100,15,0,chosen,The user suppresses the target and makes its move go last.
acrobatics,Acrobatics,flying,physical,55,100,15,0,chosen,"The user nimbly strikes the target. If the user is not holding an item, this attack inflicts massive damage."
reflect-type,Reflect Type,normal,status,,,15,0,chosen,"The user reflects the target’s type, making the user the same type as the target."
retaliate,Retaliate,normal,physical,70,100,5,0,chosen,"The user gets revenge for a fainted ally. If an ally fainted in the previous turn, this move’s power is increased."
final-gambit,Final Gambit,fighting,special,,100,5,0,chosen,The user risks everything to attack its target. The user faints but does damage equal to its HP.
bestow,Bestow,normal,status,,,15,0,chosen,The user passes its held item to the target when the target isn’t holding an item.
inferno,Inferno,fire,special,100,50,5,0,chosen,The user attacks by engulfing the target in an intense fire. This leaves the target with a burn.
water-pledge,Water Pledge,water,special,80,100,10,0,chosen,"A column of water hits the target. When used with [[moves:Fire Pledge|its fire equivalent]], its power increases and a rainbow appears."
fire-pledge,Fire Pledge,fire,special,80,100,10,0,chosen,"A column of fire hits the target. When used with [[moves:Grass Pledge|its grass equivalent]], its power increases and a vast sea of fire appears."
grass-pledge,Grass Pledge,grass,special,80,100,10,0,chosen,"A column of grass hits the target. When used with [[moves:Water Pledge|its water equivalent]], its power increases and a vast swamp appears."
